{
  "$id": "https://www.w3.org/2022/credentials/v2/verifiable-presentation-schema.json",
  "$schema": "https://json-schema.org/draft/2020-12/schema",
  "description": "JSON Schema for a Verifiable Presentation according to the Verifiable Credentials Data Model v2",
  "type": "object",
  "$defs": {
    "proof": {
      "type": "object",
      "properties": {
        "type": {
          "oneOf": [
            {
              "type": "string"
            },
            {
              "type": "array",
              "minItems": 1
            }
          ]
        },
        "proofPurpose": {
          "type": "string"
        },
        "verificationMethod": {
          "oneOf": [
            {
              "type": "string",
              "format": "uri"
            },
            {
              "type": "array",
              "minItems": 1,
              "items": {
                "type": "object",
                "properties": {
                  "id": {
                    "type": "string",
                    "format": "uri"
                  },
                  "type": {
                    "type": "string"
                  },
                  "controller": {
                    "type": "string",
                    "format": "uri"
                  }
                },
                "required": [
                  "id",
                  "type",
                  "controller"
                ],
                "additionalProperties": true
              }
            }
          ]
        },
        "created": {
          "type": "string",
          "format": "date-time",
          "pattern": "-?([1-9][0-9]{3,}|0[0-9]{3})-(0[1-9]|1[0-2])-(0[1-9]|[12][0-9]|3[01])T(([01][0-9]|2[0-3]):[0-5][0-9]:[0-5][0-9](\\.[0-9]+)?|(24:00:00(\\.0+)?))(Z|(\\+|-)((0[0-9]|1[0-3]):[0-5][0-9]|14:00))"
        },
        "domain": {
          "type": "string"
        },
        "challenge": {
          "type": "string"
        },
        "proofValue": {
          "type": "string"
        }
      },
      "required": [
        "type",
        "proofPurpose",
        "verificationMethod",
        "created"
      ],
      "additionalProperties": true
    },
    "proofChain": {
      "type": "array",
      "items": {
        "$ref": "#/$defs/proof"
      },
      "minItems": 1
    }
  },
  "properties": {
    "@context": {
      "type": "array",
      "contains": {
        "const": "https://www.w3.org/ns/credentials/v2"
      },
      "minItems": 1
    },
    "id": {
      "type": "string",
      "format": "uri"
    },
    "type": {
      "oneOf": [
        {
          "type": "array",
          "contains": {
            "const": "VerifiablePresentation"
          }
        },
        {
          "type": "string",
          "enum": ["VerifiablePresentation"]
        }
      ]
    },
    "verifiableCredential": {
      "oneOf": [
        {
          "$ref": "https://www.w3.org/2022/credentials/v2/verifiable-credential-schema.json"
        },
        {
          "type": "array",
          "items": {
            "$ref": "https://www.w3.org/2022/credentials/v2/verifiable-credential-schema.json"
          },
          "minItems": 1
        }
      ]
    },
    "exchangeData": {
      "type": "object"
    },
    "proof": {
      "oneOf": [
        {
          "$ref": "#/$defs/proof"
        },
        {
          "type": "array",
          "items": {
            "$ref": "#/$defs/proof"
          },
          "minItems": 1
        }
      ]
    },
    "proofChain": {
      "$ref": "#/$defs/proofChain"
    }
  },
  "required": [
    "@context",
    "type"
  ],
  "additionalProperties": true
}