{
  "@context": [
    "https://www.w3.org/2018/credentials/v1",
    "https://www.w3.org/2018/credentials/examples/v1"
  ],
  "type": "VerifiablePresentation",
  "verifiableCredential": [
    {
      "@context": [
        "https://www.w3.org/2018/credentials/v1",
        "https://www.w3.org/2018/credentials/examples/v1"
      ],
      "type": ["VerifiableCredential", "UniversityDegreeCredential"],
      "credentialSchema": {
        "id": "did:example:cdf:35LB7w9ueWbagPL94T9bMLtyXDj9pX5o",
        "type": "did:example:schema:22KpkXgecryx9k7N6XN1QoN3gXwBkSU8SfyyYQG"
      },
      "issuer": "did:example:Wz4eUg7SetGfaUVCn8U9d62oDYrUJLuUtcy619",
      "validFrom": "2017-12-05T14:27:42Z",
      "credentialSubject": {
        "degreeType": "BachelorDegree",
        "degreeSchool": "College of Engineering"
      },
      "proof": {
        "type": "AnonCredDerivedCredentialv1",
        "primaryProof": "cg7wLNSi48K5qNyAVMwdYqVHSMv1Ur8i...Fg2ZvWF6zGvcSAsym2sgSk737",
        "nonRevocationProof": "mu6fg24MfJPU1HvSXsf3ybzKARib4WxG...RSce53M6UwQCxYshCuS3d2h",
        "created": "2018-06-17T10:03:48Z",
        "proofPurpose": "assertionMethod",
        "verificationMethod": "did:example:ebfeb1f712ebc6f1c276e12ec21"
      }
  }],
  "proof": {
    "type": "AnonCredPresentationProofv1",
    "proofValue": "DgYdYMUYHURJLD7xdnWRinqWCEY5u5fK...j915Lt3hMzLHoPiPQ9sSVfRrs1D",
    "created": "2018-06-17T10:03:48Z",
    "proofPurpose": "assertionMethod",
    "verificationMethod": "did:example:ebfeb1f712ebc6f1c276e12ec21"
  }
}