{
  "@context": [
    "https://www.w3.org/2018/credentials/v1",
    "https://www.w3.org/2018/credentials/examples/v1"
  ],
  "type": "VerifiablePresentation",
  
  "verifiableCredential": [{
    "@context": [
      "https://www.w3.org/2018/credentials/v1",
      "https://www.w3.org/2018/credentials/examples/v1"
    ],
    "id": "http://example.edu/credentials/1872",
    "type": ["VerifiableCredential", "AlumniCredential"],
    "issuer": "https://example.edu/issuers/565049",
    "validFrom": "2010-01-01T19:23:24Z",
    "credentialSubject": {
      "id": "did:example:ebfeb1f712ebc6f1c276e12ec21",
      "alumniOf": {
        "id": "did:example:c276e12ec21ebfeb1f712ebc6f1",
        "name": [{
          "value": "Example University",
          "lang": "en"
        }, {
          "value": "Exemple d'Universit√©",
          "lang": "fr"
        }]
      }
    },
    "proof": {
      "type": "RsaSignature2018",
      "created": "2017-06-18T21:19:10Z",
      "proofPurpose": "assertionMethod",
      "verificationMethod": "https://example.edu/issuers/565049#key-1",
      "jws": "eyJhbGciOiJSUzI1NiIsImI2NCI6ZmFsc2UsImNyaXQiOlsiYjY0Il19..TCYt5XsITJX1CxPCT8yAV-TVkIEq_PbChOMqsLfRoPsnsgw5WEuts01mq-pQy7UJiN5mgRxD-WUcX16dUEMGlv50aqzpqh4Qktb3rk-BuQy72IFLOqV0G_zS245-kronKb78cPN25DGlcTwLtjPAYuNzVBAh4vGHSrQyHUdBBPM"
    }
  }],
  
  "proof": {
    "type": "RsaSignature2018",
    "created": "2018-09-14T21:19:10Z",
    "proofPurpose": "authentication",
    "verificationMethod": "did:example:ebfeb1f712ebc6f1c276e12ec21#keys-1",
    "challenge": "1f44d55f-f161-4938-a659-f8026467f126",
    "domain": "4jt78h47fh47",
    "jws": "eyJhbGciOiJSUzI1NiIsImI2NCI6ZmFsc2UsImNyaXQiOlsiYjY0Il19..kTCYt5XsITJX1CxPCT8yAV-TVIw5WEuts01mq-pQy7UJiN5mgREEMGlv50aqzpqh4Qq_PbChOMqsLfRoPsnsgxD-WUcX16dUOqV0G_zS245-kronKb78cPktb3rk-BuQy72IFLN25DYuNzVBAh4vGHSrQyHUGlcTwLtjPAnKb78"
  }
}