{
  "@context": [
    "https://www.w3.org/2018/credentials/v1",
    "https://www.w3.org/2018/credentials/examples/v1"
  ],
  "id": "https://example.com/VP/0987654321",
  "type": ["VerifiablePresentation"],
  "verifiableCredential": [
    {
     "@context": [
       "https://www.w3.org/2018/credentials/v1",
       "https://www.w3.org/2018/credentials/examples/v1"
      ],
      "id": "http://pharma.example.com/credentials/3732",
      "type": ["VerifiableCredential", "PrescriptionCredential"],
      "issuer": "https://pharma.example.com/issuer/4",
      "validFrom": "2010-01-01T19:23:24Z",
      "credentialSubject": {
        "id": "did:example:ebfeb1f712ebc6f1c276e12ec21",
        "prescription": {
          "name": "prescription-1"
        }
      },
      "credentialStatus": {
        "id": "https://pharma.example.com/credentials/status/3#94567",
        "type": "RevocationList2020Status",
        "revocationListIndex": "94567",
        "revocationListCredential": "https://pharma.example.com/credentials/status/3"
      },
      "proof": {
        "type": "RsaSignature2018",
        "created": "2018-06-18T21:19:10Z",
        "proofPurpose": "authentication",
        "verificationMethod": "did:example:76e12ec21ebhyu1f712ebc6f1z2/keys/2",
        "challenge": "c0ae1c8e-c7e7-469f-b252-86e6a0e7387e",
        "jws": "BavEll0/I1..W3JT24="
      }
    },
    {
      "@context": [
        "https://www.w3.org/2018/credentials/v1",
        "https://www.w3.org/2018/credentials/examples/v1"
      ],
      "id": "https://example.com/VC/123456789",
      "type": ["VerifiableCredential", "PrescriptionCredential"],
      "issuer": "did:example:ebfeb1f712ebc6f1c276e12ec21",
      "validFrom": "2010-01-03T19:53:24Z",
      "credentialSubject": {
        "id": "did:example:76e12ec21ebhyu1f712ebc6f1z2",
        "prescription": {
          "name": "prescription-1"
        }
      },
      "proof": {
        "type": "RsaSignature2018",
        "created": "2018-06-17T10:03:48Z",
        "proofPurpose": "assertionMethod",
        "jws": "pYw8XNi1..Cky6Ed=",
        "verificationMethod": "did:example:ebfeb1f712ebc6f1c276e12ec21/keys/234"
      }
    }
  ],
  "proof": [{
    "type": "RsaSignature2018",
    "created": "2018-06-18T21:19:10Z",
    "proofPurpose": "authentication",
    "verificationMethod": "did:example:76e12ec21ebhyu1f712ebc6f1z2/keys/2",
    "challenge": "c0ae1c8e-c7e7-469f-b252-86e6a0e7387e",
    "jws": "BavEll0/I1..W3JT24="
  }]
}